{
  "runId": "tool-comparison-018-truthy-demo_MO-S01_1",
  "planId": "tool-comparison",
  "projectId": "truthy-demo:MO-S01:1",
  "status": "accepted",
  "attempt": 1,
  "reportPath": "reports/tool-comparison-018-truthy-demo_MO-S01_1.json",
  "specSha": "c806b925602b48ea45e1a885bdfddedd597350c3e1c7d3d8cad25214cdbfd4e8",
  "cliCommit": "f3cdc6007048da1175a9743fea32f73004438c96",
  "preregVersion": 19,
  "frozenHashes": {
    "Docs/DiagnosticRuns/e7-spec-generation.json": "0838a18744cd52d7acb74197c3e3c9e12512d3457027ced3402e506e3b99ead1",
    "Docs/DiagnosticRuns/u5a-base-typecheck.json": "f24576607085b6b96e6708c526eb47293a61e18401616692df5fafb6f57117de",
    "Docs/DiagnosticRuns/u5a-site-feasibility.json": "0c14ea47e47ddbe193068ec3af181411198528de2a1903ee0bca288f3a9e4589",
    "Docs/analysis-plan.md": "21de24e5e1895bd028c179fb06d739352bd5bb1453bf81de3789b8ddb90d69c4",
    "Docs/corpus-criteria.md": "62764d157dfd16a6cf5fffd1d0b59e7a877538185028567eac538622a8cf5963",
    "Docs/e7-spec-rule.md": "0a338bb0489ba2bc9a97fdf9ce407bcad494369440f65663986d571d810bd486",
    "Docs/generator-protocol.md": "a2565419defd198b8faeffbaaa84c8e65c7c6f8163dbb87775acbe885b68f21a",
    "Docs/labeller-prompts/judge-unit.md": "8faaa7dcc242ac110e087a00d896c95fef0d836de295d562cb8dad605930206f",
    "Docs/labeller-prompts/missed-seed.md": "17154d45f2dac168f432ff9eac6f62403118045eb0402577065924bf5fe9cd21",
    "Docs/labeller-prompts/violation.md": "f01da66e8345505a09509b012076e5e3e679636d8ebcca4ac2622c4bda073bb4",
    "Docs/labeller-route.md": "18d747c49362c47f1d21195def09227866ab0e5d24c0b75447f040edaf21512f",
    "Docs/matching-rule.md": "72b8e3663b935f7097961fdc30bd3e4f2b87a3c9fe7700f781db34ec3e311324",
    "Docs/operator-catalogue.md": "f764e1ba10edd57a149acd262d4dc5464d924d9979bb1648290cb1e3651be183",
    "Docs/threats-to-validity.md": "57d40431d946a4b74ef7f133676d4d38f959717241c37ea2a1e3dd346cbae604",
    "corpus/corpus.json": "294027ab2b1158373f559a0af840d648dd8bc6e10736d8e09c49d58bbe56bb74",
    "corpus/frozen-instrument.json": "5b6073b5dc0c4dedf8a62bf519d58cbfa2e2c7c317dd28ec45406d30f0ee539c",
    "corpus/label-plan-config.json": "84e6ab31668977c66b0bdfd672691414b8fb1b27d29d1bdfdaa015de66f2b165",
    "corpus/overlays/dry-run-test/tsconfig.patch": "d581ea3d2b87434e2a77d0a2864ddaac1999c6173b96e8ea54213d2ec6110a42",
    "corpus/overlays/ghostfolio-test/apps-api-tsconfig.patch": "e8da2f05bfa2981d47b3870e748646c045b5588bbcb85c47657f1dd26fa17884",
    "corpus/overlays/realworld-test/src-config.patch": "4b4892265a4276448006bf61bdbdc236efbfc2bdd33ca1e8077196e2b358ea56",
    "corpus/overlays/truthy-demo/npmrc.patch": "abed217f31f0383256d5ecc87a7c16cb0f553ba361bc7491551525b8b32a2273",
    "corpus/overlays/truthy-demo/package-lock.patch": "5c171979d68f9f1a8fef4b2f19a90432e35c67e33534506ee4047e52470ea2dd",
    "corpus/selections/dev-nest.json": "67a63c6c45f0418a81eff21dcfb7f5cab28ef121f6e8a6b8c16c3c23855419ca",
    "corpus/selections/dry-run-test.json": "c9e99184f4b86514aa2e8a4ddb105c355e33f756e6a38373dda9e6bc5106fcae",
    "corpus/selections/eryzerz__nestjs-ddd.json": "29d0b31b13c8c6a7212ef6948cf01f1c8871672d0d4a45df334d0fa74f7815e2",
    "corpus/selections/ghostfolio-test.json": "738577cea293ad2f953a61275b41f1faf5cb23e80db7dcb20dd26a214d36b5df",
    "corpus/selections/nestjslatam__ddd.json": "92d3d17ac14efe90a3d7075a7ff10d06e49777d1a191385efb4477a68ca0049c",
    "corpus/selections/raouf-b-dev__ecommerce-store-api.json": "19f5e557d0be06c185ce399915d328db46fc6e2a655f83a4be5353020f009d26",
    "corpus/selections/realworld-test.json": "ad42fd1951f375cba4873684af1e03b1fcb9577fde4b52cdf6c97541f478dc37",
    "corpus/selections/truthy-demo.json": "af21624ecec4bb30e5368c487630b6ba339e262c8211ac40487fc172aa351e97",
    "corpus/selections/v-aguiar__valex.json": "5e09fca34d57ca58049d920f1c8482a71cf93d263681e4eed958f833c648cd99",
    "corpus/selections/zhuravlevma__nestjs-active-record.json": "68633e1890a922db84605d77ac5d82b9a9b5cde381cdb5ef8309bdd4c172d10a",
    "corpus/selections/zhuravlevma__typescript-ddd-architecture.json": "99e8dcbac44b874606851f089d731be4f27dbab5501e85461976569d8fd64041",
    "corpus/specs/MarvinRF__nest-docfy.yaml": "e097014c9ac6199049c72977ad2a00c1b2bb1df2e6cb2fa0064ca2c7542c8ed2",
    "corpus/specs/dev-nest.yaml": "c94da6be520ab9ac34789ed73b650d0c59ae257d874423731288ce5cb05068f7",
    "corpus/specs/dry-run-test.yaml": "40019222cdc6c69ce179af4b2fd9672d815594818ef92b0854e6e3f164562563",
    "corpus/specs/eryzerz__nestjs-ddd.yaml": "3afc343ecc56000d8712c488c3087536d43172ed7e26775f3d16f952228d5fec",
    "corpus/specs/ghostfolio-test.yaml": "c806b925602b48ea45e1a885bdfddedd597350c3e1c7d3d8cad25214cdbfd4e8",
    "corpus/specs/nestjslatam__ddd.yaml": "86e057f0e543484470eeac9383f0b3a8b324c11f05dbe44bcf447b48a32c4e7b",
    "corpus/specs/raouf-b-dev__ecommerce-store-api.yaml": "ce73c4639264ac2a05a89ceb8b24eaee9061004984205d1fbf778f262ac4839c",
    "corpus/specs/realworld-test.yaml": "c806b925602b48ea45e1a885bdfddedd597350c3e1c7d3d8cad25214cdbfd4e8",
    "corpus/specs/truthy-demo.yaml": "c806b925602b48ea45e1a885bdfddedd597350c3e1c7d3d8cad25214cdbfd4e8",
    "corpus/specs/v-aguiar__valex.yaml": "3311daa90f099a8f27905466ffe73933364581c364b6b4d06b633a5cfde8684f",
    "corpus/specs/zhuravlevma__nestjs-active-record.yaml": "532905a184bdd5acd5b42c15a9d1e5fae47e75f4569565ebe7e869cee4b80ab4",
    "corpus/specs/zhuravlevma__typescript-ddd-architecture.yaml": "4dbdf333b1c05b3cf64e6241f47a684ecac02c8977dcebc9920c18693047d4c8",
    "experiments/apg-ablation/plan.json": "8e726e94761930f13c0f9dcbf2fd1e07db29f2e4b8cc40eaa0a79bf6c025b933",
    "experiments/e1-grid/generator-plan-codex.json": "39a614f0f3ce3b42d8d6ae30c99f4d24f95aeed91c35b562535f32c359ac81e0",
    "experiments/e1-grid/generator-plan.json": "9032124bcae7ea40fdd16769b3f4bd9fb4c472659e17adf4f717921eb205f9c7",
    "experiments/e1-grid/plan.json": "c9b3511326727ff658769fefdefca7aea81ea14d77dccf9d20fa4bb3ef6f5093",
    "experiments/e7-corpus-v1sym/plan.json": "e2723f831517746df92ce79155f8abffd3e785d436261c93f672a3875b2d2fbc",
    "experiments/e7-corpus/plan.json": "466db3635ea680796c83f8ab15f92d4001e0219696d0aa6ab1bb09efe11396c8",
    "experiments/fixtures/plan.json": "33d9a180918e8d6607273c82b0334b39729ff438543ed53f2d813217c6c7e222",
    "experiments/latency-gate/plan.json": "18c341d132e5931562edbb6d8c32abfb5ef5064053d4322502e131aa5ae736c2",
    "experiments/real-pairs/plan.json": "95e02a3c01963641024a364b130ddb72f34cc3f6a291ed64f70da792b6d68ad6",
    "experiments/sensitivity/plan.json": "54425f4ffb2ca29f72b7df5f1779488575ad24360498570ff732ed44d9bc6566",
    "experiments/so4-heldout/plan.json": "72208c0bbe54d1c129fcb5461174d13f70d5cc81252c21e2194c4aa9c18990ba",
    "experiments/tool-comparison/depcruise/package-lock.json": "1972704d8c6a6716ad33f760cb17ec20c72aecf325c03cff4042ee2f53493de4",
    "experiments/tool-comparison/depcruise/package.json": "99cff4d2ee42d5cd8c043d0929f9bc11896aac736b18cc111ea9efa77dafe95a",
    "experiments/tool-comparison/plan.json": "600f1284bf9acc1daacbdbc3124f0c84368c61a6520fadefba663b4650626ee4",
    "presets/clean-architecture.yaml": "285447919fcedee05b8c0a5b01a61a82a36e2c0a482010b3b305863ae2dddf68",
    "presets/layered.yaml": "f0d9045de2364b8dae1ca56b584efd67fb035d9807b983ce4e6f8a7e334eade8",
    "presets/nestjs.yaml": "0172db1cb6160d5e92959ef9188be5e7bfdd9667e20ee8b34eecb3753e30997f",
    "scripts/corpus-rubric-u4-cli.ts": "0137f7922c9195c7401e6371cf1a5d079fb723789d3f4afe4a5965dffc6ba281",
    "scripts/corpus-rubric-u4.ts": "cb701491562fa04450c8ce9d3f247347a81bb5334d756242fbbc8a24171b1b93",
    "scripts/depcruise-translate.ts": "f20f77b9107a52e7a31bcb0c0b999ced0dff4024bc9627304fbd4136fa08583f",
    "scripts/generate-e7-specs-cli.ts": "92ecc716e3a1cffec90b6596eb39ef0fd1d705f5e2e3a2796dbd7c085a741e0b",
    "scripts/generate-e7-specs.ts": "ebb262a7787eabc70242c5353bf5d9dbe6af2599cd1c4395117cca03b83c1492",
    "scripts/generator/codex/model-catalog.json": "a35465f4105d76b0e2b30b688dea9f4a3c80a1f006c6a12a505f5b49b9027383",
    "scripts/generator/prompts/full-aac.md": "38c5ec683b45cffba264f6829f7367ba2145ec7c95485f8b2a3b3a9ac2d2b125",
    "scripts/generator/prompts/minimal-prose.md": "7d7a78a922fe345dce479e24991a4669d8f0257e555526be4d69632e69c6563c",
    "scripts/generator/prompts/none.md": "cc49003c5384c6f5f65f40d688082a1a1334662756994a32d139ec82b6245895",
    "scripts/migrate-corpus-spec-cli.ts": "82e9e79387cddb58cc045dd12ee04ef223e852ff76db5df9a61731ae3db96b28",
    "scripts/migrate-corpus-spec.ts": "ee1a97dbb471da622ff2cad818308c152b99c19a2b686f1cda2b8b0a9b5f5504",
    "scripts/remap-domain-layer-cli.ts": "4fd513e8b5c8b26662810dca47c54a187b64d1334153062c3abb3df0b43ee843",
    "scripts/remap-domain-layer.ts": "774fedc310782a72e9d3e93d79b251b0d1653ce3d8a74aa738b24a0935eac990",
    "specs/clean-arch.yaml": "91bd152e0ae58dcc28a35f2ebc6fe264bf9ff7cd11a2fa6a8094ef54fcd6f6a8",
    "tests/fixtures/u5a/layered/firewall.spec.yaml": "2e1c264086bbd12b5f2508220a71eb4687a8d532179831c7ab1b238ef5deaa6e"
  },
  "instrumentVersion": 2,
  "envRecordId": "env-33a4bddaf654",
  "startedAt": "2026-10-10T20:23:23.238Z",
  "wallMs": 2576,
  "seed": {
    "seedId": "truthy-demo:MO-S01:1",
    "baseProjectId": "truthy-demo",
    "split": "held-out",
    "baseKind": "corpus",
    "manifestPath": "../daedalus-so4/manifest.json",
    "baselineReportPath": "reports/tool-comparison-002-truthy-demo.json"
  }
}
