{
  "runId": "so4-heldout-089-dry-run-test_MO-X01n_0",
  "planId": "so4-heldout",
  "projectId": "dry-run-test:MO-X01n:0",
  "status": "accepted",
  "attempt": 1,
  "reportPath": "reports/so4-heldout-089-dry-run-test_MO-X01n_0.json",
  "specSha": "40019222cdc6c69ce179af4b2fd9672d815594818ef92b0854e6e3f164562563",
  "cliCommit": "58e5236471a36dba797ca51b483d6d11ac050070",
  "preregVersion": 10,
  "frozenHashes": {
    "Docs/DiagnosticRuns/e7-spec-generation.json": "0838a18744cd52d7acb74197c3e3c9e12512d3457027ced3402e506e3b99ead1",
    "Docs/DiagnosticRuns/u5a-base-typecheck.json": "f24576607085b6b96e6708c526eb47293a61e18401616692df5fafb6f57117de",
    "Docs/DiagnosticRuns/u5a-site-feasibility.json": "0c14ea47e47ddbe193068ec3af181411198528de2a1903ee0bca288f3a9e4589",
    "Docs/analysis-plan.md": "77c3c8153a9056ecccab29531014921eec875960e88e6db31d26bc496c82b753",
    "Docs/corpus-criteria.md": "ae39ede5f6d524fef947fc5186bf37d79787dbae719d6d8caf0efd714292392d",
    "Docs/e7-spec-rule.md": "ace1f6de73a04eabb31f2fabebab76798064d349ddba16811a7c81338ff9bd34",
    "Docs/generator-protocol.md": "a5c76eb6fc62d4de3133b7717d6342a203d9b724c54de3f9a7bd1d901956e929",
    "Docs/labeller-prompts/judge-unit.md": "8faaa7dcc242ac110e087a00d896c95fef0d836de295d562cb8dad605930206f",
    "Docs/labeller-prompts/missed-seed.md": "17154d45f2dac168f432ff9eac6f62403118045eb0402577065924bf5fe9cd21",
    "Docs/labeller-prompts/violation.md": "f01da66e8345505a09509b012076e5e3e679636d8ebcca4ac2622c4bda073bb4",
    "Docs/labeller-route.md": "72c557ca37f02453dcdd8ee52ecbea797d64cfec0eae9164652ca9ef102eb79a",
    "Docs/matching-rule.md": "72b8e3663b935f7097961fdc30bd3e4f2b87a3c9fe7700f781db34ec3e311324",
    "Docs/operator-catalogue.md": "f764e1ba10edd57a149acd262d4dc5464d924d9979bb1648290cb1e3651be183",
    "Docs/threats-to-validity.md": "667fd2cf63e30a494fba639baac8d963e1a242bce9b72bfec1a6dc21e0402de9",
    "corpus/corpus.json": "2554dece0ab4c186be58d86b6fa437159c3dbaa1a100be8a9b643958fd0d8517",
    "corpus/frozen-instrument.json": "6672293d6d2e02052436fd77e6e33aab600d4d449053dc170b255ad09c7341da",
    "corpus/label-plan-config.json": "efdbf5891c0316ed43e6d8b723a3d446defcf6c8fef0cd73fc5206593c27fc88",
    "corpus/overlays/dry-run-test/tsconfig.patch": "d581ea3d2b87434e2a77d0a2864ddaac1999c6173b96e8ea54213d2ec6110a42",
    "corpus/overlays/ghostfolio-test/apps-api-tsconfig.patch": "e8da2f05bfa2981d47b3870e748646c045b5588bbcb85c47657f1dd26fa17884",
    "corpus/overlays/realworld-test/src-config.patch": "4b4892265a4276448006bf61bdbdc236efbfc2bdd33ca1e8077196e2b358ea56",
    "corpus/overlays/truthy-demo/npmrc.patch": "abed217f31f0383256d5ecc87a7c16cb0f553ba361bc7491551525b8b32a2273",
    "corpus/overlays/truthy-demo/package-lock.patch": "5c171979d68f9f1a8fef4b2f19a90432e35c67e33534506ee4047e52470ea2dd",
    "corpus/selections/dev-nest.json": "67a63c6c45f0418a81eff21dcfb7f5cab28ef121f6e8a6b8c16c3c23855419ca",
    "corpus/selections/dry-run-test.json": "c9e99184f4b86514aa2e8a4ddb105c355e33f756e6a38373dda9e6bc5106fcae",
    "corpus/selections/eryzerz__nestjs-ddd.json": "29d0b31b13c8c6a7212ef6948cf01f1c8871672d0d4a45df334d0fa74f7815e2",
    "corpus/selections/ghostfolio-test.json": "738577cea293ad2f953a61275b41f1faf5cb23e80db7dcb20dd26a214d36b5df",
    "corpus/selections/nestjslatam__ddd.json": "92d3d17ac14efe90a3d7075a7ff10d06e49777d1a191385efb4477a68ca0049c",
    "corpus/selections/realworld-test.json": "ad42fd1951f375cba4873684af1e03b1fcb9577fde4b52cdf6c97541f478dc37",
    "corpus/selections/truthy-demo.json": "af21624ecec4bb30e5368c487630b6ba339e262c8211ac40487fc172aa351e97",
    "corpus/selections/v-aguiar__valex.json": "5e09fca34d57ca58049d920f1c8482a71cf93d263681e4eed958f833c648cd99",
    "corpus/selections/zhuravlevma__nestjs-active-record.json": "68633e1890a922db84605d77ac5d82b9a9b5cde381cdb5ef8309bdd4c172d10a",
    "corpus/specs/MarvinRF__nest-docfy.yaml": "e097014c9ac6199049c72977ad2a00c1b2bb1df2e6cb2fa0064ca2c7542c8ed2",
    "corpus/specs/dev-nest.yaml": "c94da6be520ab9ac34789ed73b650d0c59ae257d874423731288ce5cb05068f7",
    "corpus/specs/dry-run-test.yaml": "40019222cdc6c69ce179af4b2fd9672d815594818ef92b0854e6e3f164562563",
    "corpus/specs/eryzerz__nestjs-ddd.yaml": "3afc343ecc56000d8712c488c3087536d43172ed7e26775f3d16f952228d5fec",
    "corpus/specs/ghostfolio-test.yaml": "c806b925602b48ea45e1a885bdfddedd597350c3e1c7d3d8cad25214cdbfd4e8",
    "corpus/specs/nestjslatam__ddd.yaml": "86e057f0e543484470eeac9383f0b3a8b324c11f05dbe44bcf447b48a32c4e7b",
    "corpus/specs/realworld-test.yaml": "c806b925602b48ea45e1a885bdfddedd597350c3e1c7d3d8cad25214cdbfd4e8",
    "corpus/specs/truthy-demo.yaml": "c806b925602b48ea45e1a885bdfddedd597350c3e1c7d3d8cad25214cdbfd4e8",
    "corpus/specs/v-aguiar__valex.yaml": "3311daa90f099a8f27905466ffe73933364581c364b6b4d06b633a5cfde8684f",
    "corpus/specs/zhuravlevma__nestjs-active-record.yaml": "532905a184bdd5acd5b42c15a9d1e5fae47e75f4569565ebe7e869cee4b80ab4",
    "experiments/apg-ablation/plan.json": "8e726e94761930f13c0f9dcbf2fd1e07db29f2e4b8cc40eaa0a79bf6c025b933",
    "experiments/e1-grid/generator-plan.json": "9032124bcae7ea40fdd16769b3f4bd9fb4c472659e17adf4f717921eb205f9c7",
    "experiments/e1-grid/plan.json": "7d6490dd273cdb201afe1f6c2270d651f5d2dc93ed32b0f20670c4e61b655e69",
    "experiments/e7-corpus/plan.json": "6a922b513ee5ea112877418de1f5481120b84a85fc6096a33b2ff89de8d256ae",
    "experiments/fixtures/plan.json": "33d9a180918e8d6607273c82b0334b39729ff438543ed53f2d813217c6c7e222",
    "experiments/latency-gate/plan.json": "18c341d132e5931562edbb6d8c32abfb5ef5064053d4322502e131aa5ae736c2",
    "experiments/sensitivity/plan.json": "54425f4ffb2ca29f72b7df5f1779488575ad24360498570ff732ed44d9bc6566",
    "experiments/so4-heldout/plan.json": "72208c0bbe54d1c129fcb5461174d13f70d5cc81252c21e2194c4aa9c18990ba",
    "presets/clean-architecture.yaml": "285447919fcedee05b8c0a5b01a61a82a36e2c0a482010b3b305863ae2dddf68",
    "presets/layered.yaml": "f0d9045de2364b8dae1ca56b584efd67fb035d9807b983ce4e6f8a7e334eade8",
    "presets/nestjs.yaml": "0172db1cb6160d5e92959ef9188be5e7bfdd9667e20ee8b34eecb3753e30997f",
    "scripts/corpus-rubric-u4-cli.ts": "0137f7922c9195c7401e6371cf1a5d079fb723789d3f4afe4a5965dffc6ba281",
    "scripts/corpus-rubric-u4.ts": "cb701491562fa04450c8ce9d3f247347a81bb5334d756242fbbc8a24171b1b93",
    "scripts/generate-e7-specs-cli.ts": "92ecc716e3a1cffec90b6596eb39ef0fd1d705f5e2e3a2796dbd7c085a741e0b",
    "scripts/generate-e7-specs.ts": "ebb262a7787eabc70242c5353bf5d9dbe6af2599cd1c4395117cca03b83c1492",
    "scripts/generator/prompts/full-aac.md": "38c5ec683b45cffba264f6829f7367ba2145ec7c95485f8b2a3b3a9ac2d2b125",
    "scripts/generator/prompts/minimal-prose.md": "7d7a78a922fe345dce479e24991a4669d8f0257e555526be4d69632e69c6563c",
    "scripts/generator/prompts/none.md": "cc49003c5384c6f5f65f40d688082a1a1334662756994a32d139ec82b6245895",
    "scripts/migrate-corpus-spec-cli.ts": "82e9e79387cddb58cc045dd12ee04ef223e852ff76db5df9a61731ae3db96b28",
    "scripts/migrate-corpus-spec.ts": "ee1a97dbb471da622ff2cad818308c152b99c19a2b686f1cda2b8b0a9b5f5504",
    "scripts/remap-domain-layer-cli.ts": "4fd513e8b5c8b26662810dca47c54a187b64d1334153062c3abb3df0b43ee843",
    "scripts/remap-domain-layer.ts": "774fedc310782a72e9d3e93d79b251b0d1653ce3d8a74aa738b24a0935eac990",
    "specs/clean-arch.yaml": "91bd152e0ae58dcc28a35f2ebc6fe264bf9ff7cd11a2fa6a8094ef54fcd6f6a8",
    "tests/fixtures/u5a/layered/firewall.spec.yaml": "2e1c264086bbd12b5f2508220a71eb4687a8d532179831c7ab1b238ef5deaa6e"
  },
  "instrumentVersion": 2,
  "envRecordId": "env-4f95c97dc9cc",
  "startedAt": "2026-10-09T23:42:52.927Z",
  "wallMs": 3125,
  "seed": {
    "seedId": "dry-run-test:MO-X01n:0",
    "baseProjectId": "dry-run-test",
    "split": "held-out",
    "baseKind": "corpus",
    "manifestPath": "../daedalus-so4/manifest.json",
    "baselineReportPath": "reports/so4-heldout-003-dry-run-test.json"
  }
}
