{
  "runId": "sensitivity-005-correct-reference_SP-FF-S04_0",
  "planId": "sensitivity",
  "projectId": "correct-reference:SP-FF-S04:0",
  "status": "accepted",
  "attempt": 1,
  "reportPath": "reports/sensitivity-005-correct-reference_SP-FF-S04_0.json",
  "specSha": "373fc5535025ea5a2226e2434fd01fc4b25283ef8974b030815a324d96e3375e",
  "cliCommit": "747950cb42c60d5bc775902fe96c6e1c51292161",
  "preregVersion": 5,
  "frozenHashes": {
    "Docs/DiagnosticRuns/e7-spec-generation.json": "0838a18744cd52d7acb74197c3e3c9e12512d3457027ced3402e506e3b99ead1",
    "Docs/DiagnosticRuns/u5a-base-typecheck.json": "f24576607085b6b96e6708c526eb47293a61e18401616692df5fafb6f57117de",
    "Docs/DiagnosticRuns/u5a-site-feasibility.json": "0c14ea47e47ddbe193068ec3af181411198528de2a1903ee0bca288f3a9e4589",
    "Docs/analysis-plan.md": "032f86e88da7c68d03cb8241a552c2b0fb7ad2fe443ada2e70c83ce3d2bbf869",
    "Docs/corpus-criteria.md": "ae39ede5f6d524fef947fc5186bf37d79787dbae719d6d8caf0efd714292392d",
    "Docs/e7-spec-rule.md": "ace1f6de73a04eabb31f2fabebab76798064d349ddba16811a7c81338ff9bd34",
    "Docs/generator-protocol.md": "a5c76eb6fc62d4de3133b7717d6342a203d9b724c54de3f9a7bd1d901956e929",
    "Docs/labeller-prompts/judge-unit.md": "8faaa7dcc242ac110e087a00d896c95fef0d836de295d562cb8dad605930206f",
    "Docs/labeller-prompts/missed-seed.md": "17154d45f2dac168f432ff9eac6f62403118045eb0402577065924bf5fe9cd21",
    "Docs/labeller-prompts/violation.md": "f01da66e8345505a09509b012076e5e3e679636d8ebcca4ac2622c4bda073bb4",
    "Docs/labeller-route.md": "72c557ca37f02453dcdd8ee52ecbea797d64cfec0eae9164652ca9ef102eb79a",
    "Docs/matching-rule.md": "b0f2848598a02f5c8d2f65045d3963edcacd2d506684003ece921b944898e691",
    "Docs/operator-catalogue.md": "f764e1ba10edd57a149acd262d4dc5464d924d9979bb1648290cb1e3651be183",
    "Docs/threats-to-validity.md": "ab05a5be7fd123f7740cfd8c5c2f6a90a2d2d1f0a3d5a4d4633e1fe2d987a2b0",
    "corpus/corpus.json": "2554dece0ab4c186be58d86b6fa437159c3dbaa1a100be8a9b643958fd0d8517",
    "corpus/frozen-instrument.json": "d6a62cb11c0c731c895c642e6ba7f6faec466fdf27e2580f58dcfe412510f37f",
    "corpus/label-plan-config.json": "efdbf5891c0316ed43e6d8b723a3d446defcf6c8fef0cd73fc5206593c27fc88",
    "corpus/overlays/dry-run-test/tsconfig.patch": "d581ea3d2b87434e2a77d0a2864ddaac1999c6173b96e8ea54213d2ec6110a42",
    "corpus/overlays/ghostfolio-test/apps-api-tsconfig.patch": "e8da2f05bfa2981d47b3870e748646c045b5588bbcb85c47657f1dd26fa17884",
    "corpus/overlays/realworld-test/src-config.patch": "4b4892265a4276448006bf61bdbdc236efbfc2bdd33ca1e8077196e2b358ea56",
    "corpus/overlays/truthy-demo/npmrc.patch": "abed217f31f0383256d5ecc87a7c16cb0f553ba361bc7491551525b8b32a2273",
    "corpus/overlays/truthy-demo/package-lock.patch": "5c171979d68f9f1a8fef4b2f19a90432e35c67e33534506ee4047e52470ea2dd",
    "corpus/selections/dev-nest.json": "67a63c6c45f0418a81eff21dcfb7f5cab28ef121f6e8a6b8c16c3c23855419ca",
    "corpus/selections/dry-run-test.json": "c9e99184f4b86514aa2e8a4ddb105c355e33f756e6a38373dda9e6bc5106fcae",
    "corpus/selections/eryzerz__nestjs-ddd.json": "29d0b31b13c8c6a7212ef6948cf01f1c8871672d0d4a45df334d0fa74f7815e2",
    "corpus/selections/ghostfolio-test.json": "738577cea293ad2f953a61275b41f1faf5cb23e80db7dcb20dd26a214d36b5df",
    "corpus/selections/nestjslatam__ddd.json": "92d3d17ac14efe90a3d7075a7ff10d06e49777d1a191385efb4477a68ca0049c",
    "corpus/selections/realworld-test.json": "ad42fd1951f375cba4873684af1e03b1fcb9577fde4b52cdf6c97541f478dc37",
    "corpus/selections/truthy-demo.json": "af21624ecec4bb30e5368c487630b6ba339e262c8211ac40487fc172aa351e97",
    "corpus/selections/v-aguiar__valex.json": "5e09fca34d57ca58049d920f1c8482a71cf93d263681e4eed958f833c648cd99",
    "corpus/selections/zhuravlevma__nestjs-active-record.json": "68633e1890a922db84605d77ac5d82b9a9b5cde381cdb5ef8309bdd4c172d10a",
    "corpus/specs/MarvinRF__nest-docfy.yaml": "dbb626bbacaa5d51482cbdd93609d409185a63837fd2f0563ad9eb812dcea1a0",
    "corpus/specs/dev-nest.yaml": "06c5a3d86dbc6f51b26e2835cae8008d65ec47c98fed5cc4239046159491ff39",
    "corpus/specs/dry-run-test.yaml": "dbdca3b5f1a47cd35556c19ddffd5ab734e63035d56e4960fa356e0a67536317",
    "corpus/specs/eryzerz__nestjs-ddd.yaml": "8cb1a7a276cd539981d27cbe58835e8cc473fddb82b153a1ce5b6cb0b1864d24",
    "corpus/specs/ghostfolio-test.yaml": "08e7ba247c4dc428296bc5cc13a31798f86630d09804dc6adc2496d5c3675244",
    "corpus/specs/nestjslatam__ddd.yaml": "ad1671c91b53b4a41973864e0e4491c42d451883afe21471dd89f1a63d156607",
    "corpus/specs/realworld-test.yaml": "08e7ba247c4dc428296bc5cc13a31798f86630d09804dc6adc2496d5c3675244",
    "corpus/specs/truthy-demo.yaml": "08e7ba247c4dc428296bc5cc13a31798f86630d09804dc6adc2496d5c3675244",
    "corpus/specs/v-aguiar__valex.yaml": "32c150f2fc77ba76541f2417c5328375943a6a2d5bf15608cc14fb6099bf936a",
    "corpus/specs/zhuravlevma__nestjs-active-record.yaml": "8c1c80522488c177915f7bbd89b29edcb2a0f31cf375847d8ac26e59941a6064",
    "experiments/apg-ablation/plan.json": "8e726e94761930f13c0f9dcbf2fd1e07db29f2e4b8cc40eaa0a79bf6c025b933",
    "experiments/e1-grid/generator-plan.json": "9032124bcae7ea40fdd16769b3f4bd9fb4c472659e17adf4f717921eb205f9c7",
    "experiments/e1-grid/plan.json": "7d6490dd273cdb201afe1f6c2270d651f5d2dc93ed32b0f20670c4e61b655e69",
    "experiments/e7-corpus/plan.json": "6a922b513ee5ea112877418de1f5481120b84a85fc6096a33b2ff89de8d256ae",
    "experiments/fixtures/plan.json": "33d9a180918e8d6607273c82b0334b39729ff438543ed53f2d813217c6c7e222",
    "experiments/latency-gate/plan.json": "18c341d132e5931562edbb6d8c32abfb5ef5064053d4322502e131aa5ae736c2",
    "experiments/sensitivity/plan.json": "f1db34e07c03e303957c7ec98eb0f9df0fed4c9f2497345abf6a0b598bed1bd0",
    "experiments/so4-heldout/plan.json": "3ef0a97206cc52796dff5061ec771909ced138e940e55753c641c51211235a78",
    "presets/clean-architecture.yaml": "663f83cbef993c69a792ce8b87a0aa0b0f26e81d16680b111989d9d2d6a86178",
    "presets/layered.yaml": "05ff62ee97dce53b307c3a3d7101108670a243848e19903b681084a42597aa3d",
    "presets/nestjs.yaml": "00c9136f10086ef41a7da05e89d7208bb26cf4766d4568f0b14e331ca844fc89",
    "scripts/corpus-rubric-u4-cli.ts": "0137f7922c9195c7401e6371cf1a5d079fb723789d3f4afe4a5965dffc6ba281",
    "scripts/corpus-rubric-u4.ts": "cb701491562fa04450c8ce9d3f247347a81bb5334d756242fbbc8a24171b1b93",
    "scripts/generate-e7-specs-cli.ts": "92ecc716e3a1cffec90b6596eb39ef0fd1d705f5e2e3a2796dbd7c085a741e0b",
    "scripts/generate-e7-specs.ts": "ebb262a7787eabc70242c5353bf5d9dbe6af2599cd1c4395117cca03b83c1492",
    "scripts/generator/prompts/full-aac.md": "38c5ec683b45cffba264f6829f7367ba2145ec7c95485f8b2a3b3a9ac2d2b125",
    "scripts/generator/prompts/minimal-prose.md": "7d7a78a922fe345dce479e24991a4669d8f0257e555526be4d69632e69c6563c",
    "scripts/generator/prompts/none.md": "cc49003c5384c6f5f65f40d688082a1a1334662756994a32d139ec82b6245895",
    "scripts/migrate-corpus-spec-cli.ts": "82e9e79387cddb58cc045dd12ee04ef223e852ff76db5df9a61731ae3db96b28",
    "scripts/migrate-corpus-spec.ts": "ee1a97dbb471da622ff2cad818308c152b99c19a2b686f1cda2b8b0a9b5f5504",
    "scripts/remap-domain-layer-cli.ts": "4fd513e8b5c8b26662810dca47c54a187b64d1334153062c3abb3df0b43ee843",
    "scripts/remap-domain-layer.ts": "774fedc310782a72e9d3e93d79b251b0d1653ce3d8a74aa738b24a0935eac990",
    "specs/clean-arch.yaml": "373fc5535025ea5a2226e2434fd01fc4b25283ef8974b030815a324d96e3375e",
    "tests/fixtures/u5a/layered/firewall.spec.yaml": "cebbeb626fbaa46985caeaf0bfa32e95bad52543e11a878d08f56b025434b10c"
  },
  "envRecordId": "env-dd996fe3e179",
  "startedAt": "2026-10-09T16:40:01.423Z",
  "wallMs": 1003,
  "seed": {
    "seedId": "correct-reference:SP-FF-S04:0",
    "baseProjectId": "correct-reference",
    "split": "probe",
    "baseKind": "fixture",
    "manifestPath": "../daedalus-sp-probes/manifest.json",
    "baselineReportPath": "reports/sensitivity-000-correct-reference.json"
  }
}
